{
  "$schema": "./schemas/verse-scramble.schema.json",
  "game": "verse-scramble",
  "version": 1,
  "displayName": "Verse Scramble",
  "roundsPerSession": 5,
  "sessions": [
    {
      "id": "vs-session-01",
      "title": "Verse Scramble Pack 1",
      "theme": "KJV memory verses",
      "rounds": [
        {
          "id": "vs-r001",
          "reference": "Genesis 1:1",
          "referenceAliases": [
            "Genesis 1:1",
            "Gen 1:1"
          ],
          "sourceTranslation": "KJV",
          "theme": "Creation",
          "verseText": "In the beginning God created the heaven and the earth.",
          "difficulty": "easy",
          "teachingNote": "Genesis 1:1 grounds God as Creator in the words \"In the beginning God created the heaven and the earth.\" That phrase is the textual detail to connect back to the answer."
        },
        {
          "id": "vs-r002",
          "reference": "Exodus 14:14",
          "referenceAliases": [
            "Exodus 14:14",
            "Exod 14:14"
          ],
          "sourceTranslation": "KJV",
          "theme": "Deliverance",
          "verseText": "The LORD shall fight for you, and ye shall hold your peace.",
          "difficulty": "medium",
          "teachingNote": "Exodus 14:14 grounds God's deliverance in the words \"The LORD shall fight for you, and ye shall hold your peace.\" That phrase is the textual detail to connect back to the answer."
        },
        {
          "id": "vs-r003",
          "reference": "Joshua 1:9",
          "referenceAliases": [
            "Joshua 1:9",
            "Josh 1:9"
          ],
          "sourceTranslation": "KJV",
          "theme": "Courage",
          "verseText": "Have not I commanded thee? Be strong and of a good courage; be not afraid, neither be thou dismayed: for the LORD thy God is with thee whithersoever thou goest.",
          "difficulty": "hard",
          "teachingNote": "Joshua 1:9 grounds courage grounded in God's command in the words \"Have not I commanded thee.\" That phrase is the textual detail to connect back to the answer."
        },
        {
          "id": "vs-r004",
          "reference": "Psalm 23:1",
          "referenceAliases": [
            "Psalm 23:1",
            "Ps 23:1"
          ],
          "sourceTranslation": "KJV",
          "theme": "Provision",
          "verseText": "The LORD is my shepherd; I shall not want.",
          "difficulty": "easy",
          "teachingNote": "Psalm 23:1 grounds God's provision in the words \"The LORD is my shepherd.\" That phrase is the textual detail to connect back to the answer."
        },
        {
          "id": "vs-r005",
          "reference": "Proverbs 3:5",
          "referenceAliases": [
            "Proverbs 3:5",
            "Prov 3:5"
          ],
          "sourceTranslation": "KJV",
          "theme": "Trust",
          "verseText": "Trust in the LORD with all thine heart; and lean not unto thine own understanding.",
          "difficulty": "medium",
          "teachingNote": "Proverbs 3:5 grounds trust in the Lord in the words \"Trust in the LORD with all thine heart.\" That phrase is the textual detail to connect back to the answer."
        }
      ]
    },
    {
      "id": "vs-session-02",
      "title": "Verse Scramble Pack 2",
      "theme": "KJV memory verses",
      "rounds": [
        {
          "id": "vs-r006",
          "reference": "Isaiah 40:31",
          "referenceAliases": [
            "Isaiah 40:31",
            "Isa 40:31"
          ],
          "sourceTranslation": "KJV",
          "theme": "Strength",
          "verseText": "But they that wait upon the LORD shall renew their strength; they shall mount up with wings as eagles; they shall run, and not be weary; and they shall walk, and not faint.",
          "difficulty": "hard",
          "teachingNote": "Isaiah 40:31 grounds strength that comes from the Lord in the words \"They that wait upon the LORD shall renew their strength.\" That phrase is the textual detail to connect back to the answer."
        },
        {
          "id": "vs-r007",
          "reference": "Jeremiah 29:11",
          "referenceAliases": [
            "Jeremiah 29:11",
            "Jer 29:11"
          ],
          "sourceTranslation": "KJV",
          "theme": "Hope",
          "verseText": "For I know the thoughts that I think toward you, saith the LORD, thoughts of peace, and not of evil, to give you an expected end.",
          "difficulty": "easy",
          "teachingNote": "Jeremiah 29:11 grounds hope rooted in God's promise in the words \"For I know the thoughts that I think toward you, saith the LORD, thoughts of peace.\" That phrase is the textual detail to connect back to the answer."
        },
        {
          "id": "vs-r008",
          "reference": "Micah 6:8",
          "referenceAliases": [
            "Micah 6:8",
            "Mic 6:8"
          ],
          "sourceTranslation": "KJV",
          "theme": "Justice",
          "verseText": "He hath shewed thee, O man, what is good; and what doth the LORD require of thee, but to do justly, and to love mercy, and to walk humbly with thy God?",
          "difficulty": "medium",
          "teachingNote": "Micah 6:8 grounds justice and faithful obedience in the words \"He hath shewed thee, O man, what is good.\" That phrase is the textual detail to connect back to the answer."
        },
        {
          "id": "vs-r009",
          "reference": "Ezekiel 36:26",
          "referenceAliases": [
            "Ezekiel 36:26",
            "Ezek 36:26"
          ],
          "sourceTranslation": "KJV",
          "theme": "Renewal",
          "verseText": "A new heart also will I give you, and a new spirit will I put within you: and I will take away the stony heart out of your flesh, and I will give you an heart of flesh.",
          "difficulty": "hard",
          "teachingNote": "Ezekiel 36:26 grounds spiritual renewal in the words \"A new heart also will I give you, and a new spirit will I put within.\" That phrase is the textual detail to connect back to the answer."
        },
        {
          "id": "vs-r010",
          "reference": "Habakkuk 2:4",
          "referenceAliases": [
            "Habakkuk 2:4",
            "Hab 2:4"
          ],
          "sourceTranslation": "KJV",
          "theme": "Faith",
          "verseText": "Behold, his soul which is lifted up is not upright in him: but the just shall live by his faith.",
          "difficulty": "easy",
          "teachingNote": "Habakkuk 2:4 grounds faith that trusts God's word in the words \"Behold, his soul which is lifted up is not upright in him.\" That phrase is the textual detail to connect back to the answer."
        }
      ]
    },
    {
      "id": "vs-session-03",
      "title": "Verse Scramble Pack 3",
      "theme": "KJV memory verses",
      "rounds": [
        {
          "id": "vs-r011",
          "reference": "Matthew 5:16",
          "referenceAliases": [
            "Matthew 5:16",
            "Matt 5:16"
          ],
          "sourceTranslation": "KJV",
          "theme": "Witness",
          "verseText": "Let your light so shine before men, that they may see your good works, and glorify your Father which is in heaven.",
          "difficulty": "medium",
          "teachingNote": "Matthew 5:16 grounds visible witness before others in the words \"Let your light so shine before men, that they may see your good works, and glorify.\" That phrase is the textual detail to connect back to the answer."
        },
        {
          "id": "vs-r012",
          "reference": "Matthew 11:28",
          "referenceAliases": [
            "Matthew 11:28",
            "Matt 11:28"
          ],
          "sourceTranslation": "KJV",
          "theme": "Rest",
          "verseText": "Come unto me, all ye that labour and are heavy laden, and I will give you rest.",
          "difficulty": "hard",
          "teachingNote": "Matthew 11:28 grounds rest offered by Christ in the words \"Come unto me, all ye that labour and are heavy laden, and I will give you.\" That phrase is the textual detail to connect back to the answer."
        },
        {
          "id": "vs-r013",
          "reference": "John 3:16",
          "referenceAliases": [
            "John 3:16",
            "Jn 3:16"
          ],
          "sourceTranslation": "KJV",
          "theme": "Salvation",
          "verseText": "For God so loved the world, that he gave his only begotten Son, that whosoever believeth in him should not perish, but have everlasting life.",
          "difficulty": "easy",
          "teachingNote": "John 3:16 grounds salvation through Christ in the words \"For God so loved the world, that he gave his only begotten Son, that whosoever believeth.\" That phrase is the textual detail to connect back to the answer."
        },
        {
          "id": "vs-r014",
          "reference": "John 8:12",
          "referenceAliases": [
            "John 8:12",
            "Jn 8:12"
          ],
          "sourceTranslation": "KJV",
          "theme": "Light",
          "verseText": "Then spake Jesus again unto them, saying, I am the light of the world: he that followeth me shall not walk in darkness, but shall have the light of life.",
          "difficulty": "medium",
          "teachingNote": "John 8:12 grounds Christ as light in the words \"Then spake Jesus again unto them, saying, I am the light of the world.\" That phrase is the textual detail to connect back to the answer."
        },
        {
          "id": "vs-r015",
          "reference": "John 14:6",
          "referenceAliases": [
            "John 14:6",
            "Jn 14:6"
          ],
          "sourceTranslation": "KJV",
          "theme": "Way",
          "verseText": "Jesus saith unto him, I am the way, the truth, and the life: no man cometh unto the Father, but by me.",
          "difficulty": "hard",